,Post Title,Post Score,Created UTC,Post Author,domain,url
0,t1 speaks to the number one player on the server,1,2021-04-14 22:30:47,uruha_tv,clips.twitch.tv,https://clips.twitch.tv/HonorableGloriousHippoKappaRoss-9K9GZQPNZ9QDDegL
1,forsen adds a kitboga clip line to his lines,1,2021-04-14 22:20:15,oFyle,clips.twitch.tv,https://clips.twitch.tv/LittleWonderfulCoffeeEleGiggle-cLKj3zJvHFrmjGsS
2,Shameless Just Chatting streamer twerking,0,2021-04-14 22:13:41,robeo12055,clips.twitch.tv,https://clips.twitch.tv/CrowdedNiceVelociraptorKAPOW-Kh6kGDKad3-4iSSk
3,singing with special effects,0,2021-04-14 22:04:02,jo_jo_nyeb,clips.twitch.tv,https://clips.twitch.tv/SlipperyDifferentTarsierGrammarKing-e6uJix6RFct7_OBA
4,Judberries - Streamer with migraine beats hardest GTFO Level Solo,0,2021-04-14 22:00:48,SYMemy,clips.twitch.tv,https://clips.twitch.tv/AgreeableUnsightlyMacaroniOptimizePrime-Pzc4I2_vMO5sKTlz
5,Good thing forsen has 3 Checkpoints,0,2021-04-14 21:56:06,oFyle,clips.twitch.tv,https://clips.twitch.tv/VictoriousTsundereMeatloafChocolateRain-a2GrVsnM9LLxbbru
6,Soda finds a bonfire,0,2021-04-14 21:53:10,Silanos,clips.twitch.tv,https://clips.twitch.tv/DarkImpartialSardineKeepo-Rd6mCodU-fygplrr
7,Mizkif finally does a boat stream,0,2021-04-14 21:51:55,Butchy_B,clips.twitch.tv,https://clips.twitch.tv/CrunchyInexpensiveHorseradishPeteZarollTie-Z0HsVGrhAptJfD_S?tt_medium=redt
8,Forced adds on twitch and YouTube,0,2021-04-14 21:32:40,DrifterBike,self.LivestreamFail,https://www.reddit.com/r/LivestreamFail/comments/mr0k8b/forced_adds_on_twitch_and_youtube/
9,Unconventional Cooking w -Crispyytaco,0,2021-04-14 21:30:00,clubswithseals,clips.twitch.tv,https://clips.twitch.tv/SplendidInventiveEchidnaBIRB-IjgX4P5H1oxl8bni
10,souljaboy - When somebody said $200 WTF about his new console,17,2021-04-14 21:25:02,Soulsben,clips.twitch.tv,https://clips.twitch.tv/FamousExpensiveKleeGrammarKing-VC28BzsOfTXY6kg8
11,Soda tries out modded Dark Souls 3,10,2021-04-14 20:45:49,-eDgAR-,clips.twitch.tv,https://clips.twitch.tv/TiredTallDillWTRuck-6PkrqES3RzJODMZ5
12,Announcing a 14-day GTARP cooldown,241,2021-04-14 20:35:28,Jisifus,self.LivestreamFail,https://www.reddit.com/r/LivestreamFail/comments/mqzfgk/announcing_a_14day_gtarp_cooldown/
13,Average hasan chatter,15,2021-04-14 20:26:45,Dr_CSS,clips.twitch.tv,https://clips.twitch.tv/CourteousFaithfulClipzKappa-lasjynVv8XvGsR8U
14,Maya's new acquisition to her animal sanctuary,3,2021-04-14 20:18:50,misterysp,clips.twitch.tv,https://clips.twitch.tv/ColorfulGleamingPonyWTRuck-UGGQtfnw6G5re-FY
15,Simply shows Mizkif BoobaTV,26,2021-04-14 20:17:50,MysteriiousComposer,clips.twitch.tv,https://clips.twitch.tv/NaiveBrightStarlingJebaited-0ObAmTALpEfJ9Lya
16,"Going out of bounds in World of Warcraft, several miles above the planet, after traveling for over 5 minutes... one player suffers a terrible fate.",8,2021-04-14 19:29:42,Frijid,clips.twitch.tv,https://clips.twitch.tv/ObservantRoundSheepUnSane-0vJ8wsT969pWrneI/
17,Dr. K being brutally honest,116,2021-04-14 19:21:26,The_Mlghty_Qulnn,clips.twitch.tv,https://clips.twitch.tv/ObedientRenownedDuckPanicVis-rHD5PKFDppjhb_fw?tt_medium=redt
18,Lirik gets too close,48,2021-04-14 19:01:18,Kreygasm2233,clips.twitch.tv,https://clips.twitch.tv/ProtectiveBillowingFloofTwitchRPG-rA0X6tg_tJQCmlED
19,Buddha switches to Speedys stream,30,2021-04-14 19:00:49,AkkyYT,clips.twitch.tv,https://clips.twitch.tv/AssiduousSaltyHyenaPRChase-KXs83t-VZr-YloM-?tt_medium=redt
20,Happy birthday from the news to Erobb,633,2021-04-14 18:58:07,EchoOk4335,clips.twitch.tv,https://clips.twitch.tv/SparklyArtsyPlumPeteZaroll-CwObrnd2t4tbY5Xu
21,Nice Catch MonkaS,27,2021-04-14 18:54:15,kpoplova,clips.twitch.tv,https://clips.twitch.tv/DeterminedYawningRuffNerfBlueBlaster-mrrppQu2lja9IJBJ
22,We do a little trolling,77,2021-04-14 18:34:52,astro-bloke,clips.twitch.tv,https://clips.twitch.tv/MistyHardAlfalfaHassaanChop-etWtkaKNyuFInR97
23,Tyler1's lane opponent calls him on Discord,211,2021-04-14 18:31:29,_BearHawk,clips.twitch.tv,https://clips.twitch.tv/ExcitedAlluringReubenBCWarrior-HsRpWG222x15-qpj
24,Streamer clutches a CSGO round while being scam called.,12,2021-04-14 18:31:25,TheEpicZay,twitch.tv,http://www.twitch.tv/franzjx/clip/DelightfulSullenMilkPunchTrees-dp9boxtUR46_9c9t
25,HealthyGamer_GG - You're a stupid kid,23,2021-04-14 17:54:34,canyounothelpmepls,clips.twitch.tv,https://clips.twitch.tv/BrainyEmpathicDinosaurWow-KwA3XqB7yquyLKqE
26,Tim reveals he can't even play with Doc off stream,268,2021-04-14 17:38:07,OfficialAzzaN,clips.twitch.tv,https://clips.twitch.tv/VibrantWimpyBeaverGOWSkull-RlpLjuiVFbGifK8o
27,Nick Polom on the Juicer Army,59,2021-04-14 17:27:05,danalot,clips.twitch.tv,https://clips.twitch.tv/BlightedCoyPartridgeTheRinger-8heNA6C0aYfFhYfw
28,Asmongold Defends xQc,213,2021-04-14 17:20:22,Jerry_McPhee,clips.twitch.tv,https://clips.twitch.tv/AbstruseKathishCockroachDansGame-vJpQtXJhlrGbZ_rv
29,Over 7.5 millon Bot fake twitch account has been deleted,1908,2021-04-14 17:08:06,ShadowEzio,twitter.com,https://twitter.com/TwitchSupport/status/1382379214624714756?s=19
30,Double team,24,2021-04-14 17:07:33,JamjarDinosaur,clips.twitch.tv,https://clips.twitch.tv/TacitOnerousEggMikeHogu-p0n9jkMCyDt7S7vD
31,Yuggie wasnt expecting this,5,2021-04-14 17:07:02,JamjarDinosaur,clips.twitch.tv,https://clips.twitch.tv/BrightDepressedIguanaPipeHype-YT7XI2bRTtX1-4Nh
32,Onion and 2lyn say goodbye in different ways BOOBA,800,2021-04-14 16:51:39,SuiTobi,clips.twitch.tv,https://clips.twitch.tv/SourImportantSandstormBatChest-lSrJisC9q6rlFRNW
33,LIRIK decided to keep playing Bayvon,1138,2021-04-14 16:30:35,DzejBee,clips.twitch.tv,https://clips.twitch.tv/IronicPlacidTardigradeSoBayed-j72w5GfJDPxI-1IG
34,Barry gets the Twitch experience,2,2021-04-14 16:16:51,Fairhair88,clips.twitch.tv,https://clips.twitch.tv/RockyLightPigOSfrog-eprO6v3AqVjdJJlN
35,Malena spout the forbidden word,684,2021-04-14 15:54:17,kingpussay,clips.twitch.tv,https://clips.twitch.tv/AlluringCulturedBeefYouDontSay-j0xT9jFICvcY06MD
36,Onion just downs the whole spicy noodle pot,109,2021-04-14 15:50:47,NoodleTheTree,clips.twitch.tv,https://clips.twitch.tv/WimpySecretiveGnatNerfRedBlaster-qHDUlvDL3APeptcw
37,Onion brings 2lyn Icecream after eating very spicy noodles,407,2021-04-14 15:50:18,NoodleTheTree,clips.twitch.tv,https://clips.twitch.tv/DiligentBloodyShinglePipeHype-RTNstfD8KK0loxlB
38,Coomer king gets cucked,89,2021-04-14 15:19:56,OwlThatIsNotSoWise,clips.twitch.tv,https://clips.twitch.tv/TenaciousSlickKittenSoonerLater-G2Z0Z8Pv-aDi5t8T
39,Heokong aka 'King Coomer' loses his girl to european league of legends player,2626,2021-04-14 15:19:42,Halfhander,clips.twitch.tv,https://clips.twitch.tv/FuriousBashfulCiderThunBeast-INwYofndhRYNdCss
40,Twitch grows 94% Year over Year - YouTube Gaming falls further behind,467,2021-04-14 15:01:37,criseriksen,twitter.com,https://twitter.com/GIBiz/status/1382331052132331523
41,The streets can't handle Kyle,3,2021-04-14 14:52:21,Drone_7,clips.twitch.tv,https://clips.twitch.tv/ComfortableAmazonianReubenHeyGuys-c7BY_2pTVvKBQMEo
42,Typical Onion Mating Pattern,87,2021-04-14 14:49:14,Michat111,clips.twitch.tv,https://clips.twitch.tv/HyperAttractiveLeopardCharlietheUnicorn-H39tkLt27ITnDYnA?tt_medium=redt
43,Heokong aka king coomer made it - 2Lyn visiting him,624,2021-04-14 14:43:58,Halfhander,clips.twitch.tv,https://clips.twitch.tv/ArborealSleepyPoxCorgiDerp-1g6ikwQrVAq65jWJ
44,LSPD goes full World War Z on some robbers.,6,2021-04-14 14:38:22,0TheG0,clips.twitch.tv,https://clips.twitch.tv/MagnificentTalentedCiderMingLee-xYualN9KaKZxSJZd
45,"Korean Streamer, Onion God becomes friends with one of his BOOBA streamers.",7050,2021-04-14 14:32:22,SealSquasher,clips.twitch.tv,https://clips.twitch.tv/IgnorantNurturingFalconPicoMause-jHQW_PHcf8_lBEOD
46,Why did I follow this person again? Oh...,15,2021-04-14 14:26:23,Gillesspiegel,clips.twitch.tv,https://clips.twitch.tv/ElegantFunnyQuailCoolStoryBro-WcCR3X1zcvV1HZL6
47,39Daph calls out NymN,669,2021-04-14 13:58:16,AS43_,clips.twitch.tv,https://clips.twitch.tv/CleanHedonisticEyeballSpicyBoy-sNvgti7NCR3DCLBf
48,Santi and Mr. B god teir car escape,288,2021-04-14 13:03:44,tGryffin,clips.twitch.tv,https://clips.twitch.tv/InspiringDeafGoldfishCopyThis-m7YGoYzlsuXfXC3S
49,"Rob and Fingle drove the red car and they brandish their weapon at the bank, they used Speech 100",85,2021-04-14 12:13:51,Villenthessis,clips.twitch.tv,https://clips.twitch.tv/SpeedyManlyWoodcockFunRun-iWJouKHwfKj-WjpR
50,Limmy enjoys a Jacksepticeye video,4023,2021-04-14 11:40:21,Dufflebaags,clips.twitch.tv,https://clips.twitch.tv/FreezingCharmingRingSmoocherZ-6Go19mI4yxcVctoO
51,roflgator - the fingles go on twitter,30,2021-04-14 11:21:33,abguneta,clips.twitch.tv,https://clips.twitch.tv/EndearingElegantWoodpeckerPanicBasket-Oyw4gwgL2whqE52G
52,Limmy rocks out,8,2021-04-14 11:10:18,c0xb0x,clips.twitch.tv,https://clips.twitch.tv/IcyVenomousCattleKevinTurtle-k-Zi4oMyUZcL_IYt
53,AbdulHD - An actual RP veteran explains Powergaming.,146,2021-04-14 09:55:35,0TheG0,clips.twitch.tv,https://clips.twitch.tv/PlacidVictoriousMarrowNotATK-zF7JEmRbRGxqASD0
54,daph adapts to the new meta,1758,2021-04-14 08:31:01,Artrix1001,clips.twitch.tv,https://clips.twitch.tv/FurtiveSpicyAmazon4Head-fVKLwTTO5wBA7tME
55,Froste off the grape juice,2,2021-04-14 08:23:04,MR_M0NEYY,clips.twitch.tv,https://clips.twitch.tv/CautiousDeadGazelleDerp-vdljC19pT2d9TW29
56,roflgator - Pilbis (TheBigMeech) Punches Fingle Dan,10,2021-04-14 08:14:55,TurnoverMission,clips.twitch.tv,https://clips.twitch.tv/RelentlessAmericanGarlicDogFace-7IKPap9vq7X6AWA1
57,Burger Shot employees are playing Shellyball,117,2021-04-14 08:04:05,Villenthessis,clips.twitch.tv,https://clips.twitch.tv/SourSoftDiscEagleEye-ne8ZckklobzNkLpR
58,Shelly has a rough day,40,2021-04-14 07:05:46,Villenthessis,clips.twitch.tv,https://clips.twitch.tv/DoubtfulAbstruseApeWow-sIb4PFGMVJCs-5BX
59,Lysium (Mr. B) uses 5Head strat to keep viewers,41,2021-04-14 06:57:10,MysteriiousComposer,clips.twitch.tv,https://clips.twitch.tv/ExquisiteUnusualClamWTRuck-dUOfeqIBVkASErbE
60,"Cleanbois ""accidentally"" run over fingle dan",7,2021-04-14 06:08:02,Lynxwolf191,clips.twitch.tv,https://clips.twitch.tv/RealSinglePelicanRlyTho-hv5UD4fxkAsLLVIp
61,Koil on RPing a Black Character,803,2021-04-14 05:46:43,ZeekBen,clips.twitch.tv,https://clips.twitch.tv/SnappyCuriousKittenFloof-MIrm0gj59OKtjT80
62,lerlec sets up an Ethereum wallet so his viewers can support him - SURPRISE!,36,2021-04-14 05:26:11,Robot_Sniper,clips.twitch.tv,https://clips.twitch.tv/SpineyObliviousSpiderSwiftRage-PHUlwQPyQhF_-Hzl
63,Viewer Recommends Korean Guy a BOOBA Streamer,3506,2021-04-14 05:17:46,Rekkles210,clips.twitch.tv,https://clips.twitch.tv/CarefulNastyCamelBigBrother-eStNviq9OmmCB2oo
64,Ganny checks naked hulks but,52,2021-04-14 05:15:54,shelbycola,clips.twitch.tv,https://clips.twitch.tv/SneakyQuaintRadishCmonBruh-w3mNWqwbHmgVD51R
65,Mayor reaches out to the community,67,2021-04-14 05:06:10,aviationainteasy,clips.twitch.tv,https://clips.twitch.tv/VibrantPoliteJaguarTBCheesePull-0ty-6sSf5s5GfYuI
66,Korean efficiency,260,2021-04-14 05:05:34,RaMmzZ,clips.twitch.tv,https://clips.twitch.tv/SwissStupidSeahorseKlappa-Cij2ofRGW8S52pYH
67,MOONMOON - vigor's bike reveals his position to the alta street boys,98,2021-04-14 04:56:52,Segremor,clips.twitch.tv,https://clips.twitch.tv/SmoothEsteemedPuffinHotPokket-l8CMuYY6yvZ6znQ2
68,Moistcr1tikal gets banned,107,2021-04-14 04:40:41,Neffintel,clips.twitch.tv,https://clips.twitch.tv/RefinedOnerousHedgehogBudBlast-K-ty3og9TgieARGm
69,Ro Block kinda ganster though,69,2021-04-14 04:40:29,SamGanji,twitch.tv,https://www.twitch.tv/doug/clip/LongPuzzledEelOneHand-vWFBGysOJv1tAOmS
70,Atrioc tells a story about how he knew Ludwig would become richer than him,408,2021-04-14 04:12:45,Abstractings,clips.twitch.tv,https://clips.twitch.tv/DirtyExpensiveOwlCoolStoryBro-sZiQ6RpBEFboW738
71,mang0's take on Ludwig breaking the record,252,2021-04-14 04:12:03,brycenbaggins,clips.twitch.tv,https://clips.twitch.tv/LuckyFitWolfSeemsGood-LtGNQ-lMvM8SJkAs
72,His most logical take yet,50,2021-04-14 04:08:46,tenddiez,clips.twitch.tv,https://clips.twitch.tv/RespectfulSecretiveFerretKappaClaus-HxOXXvTGzLozj9pb
73,"After days of planning to kidnap the mayor and make a snuff film, the Block gang tells her the plan",59,2021-04-14 04:08:29,TwoPieceCrow,clips.twitch.tv,https://clips.twitch.tv/BrainySarcasticBarracudaOneHand-aOnrcnJ5qAUAboXb
74,"After a month of nearly constant streaming, Ludwig's subathon ends",22763,2021-04-14 03:59:38,xerxestrux,clips.twitch.tv,https://clips.twitch.tv/RenownedExcitedSangPartyTime-K_bahdAs28WWSdR7
75,TenZ aces to make a point,90,2021-04-14 03:54:17,Moobiful,clips.twitch.tv,https://clips.twitch.tv/GlamorousRefinedGerbilImGlitch-lOhgtBxcjZhSvgTs
76,Mr. xCutie is learning Japanese from Ken-sama,6,2021-04-14 03:43:43,Villenthessis,clips.twitch.tv,https://clips.twitch.tv/CorrectBoxyOxAMPEnergyCherry-FRkwtY6jvbcxSHz4
77,X can't be there tonight,164,2021-04-14 03:42:42,TinFoilHatRonin,clips.twitch.tv,https://clips.twitch.tv/CleanVibrantCurryBatChest-cUaRBTIMtxbyg5zo
78,Happy Hobb fails his last run on his current bet and proceeds with an announcement,45,2021-04-14 03:40:25,ShadowCrimson,clips.twitch.tv,https://clips.twitch.tv/SlipperyAwkwardLeopardMikeHogu-vOr4LUi4oRNnyMmD
79,Clean Bois down bad,1687,2021-04-14 03:33:19,tzingkha,clips.twitch.tv,https://clips.twitch.tv/BadEasyEmuSwiftRage-DmnfLj3SYPu8Po43
80,Dad teaches his child how to pump gas,133,2021-04-14 03:31:49,Wojciech10,clips.twitch.tv,https://clips.twitch.tv/InterestingSolidEggTheRinger-3SuFpl1OVigDI3EZ
81,Moon gets rid of a witness,849,2021-04-14 03:28:10,Quasimdo,clips.twitch.tv,https://clips.twitch.tv/AggressiveKindButterflyTTours-lPZIyavQYAl9ileB
82,Summit -1,774,2021-04-14 03:26:18,strguri,clips.twitch.tv,https://clips.twitch.tv/KnottyScrumptiousScallionFUNgineer-FDoOCxv2RvF9if8p?tt_medium=redt
83,MOONS REAL KID IS REAL?,97,2021-04-14 03:25:56,Jollydoogz,clips.twitch.tv,https://clips.twitch.tv/MotionlessYummyWatermelonRuleFive-CwWMePEczfL7yJDE
84,X and CG have a conversation,176,2021-04-14 03:21:11,Visible-Fondant-4984,clips.twitch.tv,https://clips.twitch.tv/CrypticObliviousTortoiseBloodTrail-Ql84eoiIQrCC7mXD?tt_medium=redt
85,X & Summit caught by nightcrawler torching cop cars in 4K,74,2021-04-14 03:19:31,whatup1111trihard,clips.twitch.tv,https://clips.twitch.tv/ProtectiveFaintTrayShadyLulu-lnKE-Diqp87vwipO
86,small streamer finds new alien speedrun skip,16,2021-04-14 02:55:19,burnaboi011,clips.twitch.tv,https://clips.twitch.tv/CrispyFlaccidYamTBTacoRight-mn2LIJPnHzd1B_Vg
87,"Ro Block not stopping during a prison riot, whatever it takes",194,2021-04-14 02:52:29,Nero234,clips.twitch.tv,https://clips.twitch.tv/PuzzledExcitedPeanutDAESuppy-nNnN9oxYVJqvqOKU
88,The Benji Special 5Head,31,2021-04-14 02:51:53,CrunchGD,clips.twitch.tv,https://clips.twitch.tv/RoundCleverChickpeaStinkyCheese-IBRzc8lqsGxcZ7pZ
89,KristoferYee - Mom just being a Mom,8,2021-04-14 02:48:48,OR30_Senpai,clips.twitch.tv,https://clips.twitch.tv/PreciousAuspiciousAppleLeeroyJenkins-DR3cuaSz1x7VfSsA
90,X being a really nice manager at Burger Shot,53,2021-04-14 02:47:19,Substantial_Quote485,clips.twitch.tv,https://clips.twitch.tv/AdventurousOpenTubersNinjaGrumpy-__3eNGkeMUeWdx5v
91,MOONMOON - The Block gang take the prison,126,2021-04-14 02:40:13,IJustGotRektSon,clips.twitch.tv,https://clips.twitch.tv/MagnificentLovelyDumplingsPartyTime-iuLCRlDJ9YH8bmAx
92,SUMMIT DOES IT AGAIN!,339,2021-04-14 02:33:37,SnakeStefan,clips.twitch.tv,https://clips.twitch.tv/MotionlessObservantBillRickroll-F2TDqT2HQDjg0IpC?tt_medium=redt
93,"""Float like a butterfly, sting like a bee"" - Ro Block",51,2021-04-14 02:33:11,ketamemes__,clips.twitch.tv,https://clips.twitch.tv/TalentedSarcasticWolfKappaRoss-NCsuExuIWGVOSwLM
94,He's got the moves,25,2021-04-14 02:30:24,IJustGotRektSon,clips.twitch.tv,https://clips.twitch.tv/FuriousPrettiestGorillaKippa-CpfJ09E76Ie_Fclz
95,Officer reacts to his car being blown up by X,598,2021-04-14 02:25:48,MysteriiousComposer,clips.twitch.tv,https://clips.twitch.tv/SpoopySmallOtterOneHand-NSi3MDYrNGAzZFlF
96,X blows up a cop car at the bank with a molotov,2374,2021-04-14 02:14:02,xerxestrux,clips.twitch.tv,https://clips.twitch.tv/ResourcefulInexpensiveToadBlargNaut-OGF-CwoDmGYG7lDc
97,"Ludwig's Mods were paid $167,000 for the Subathon",1442,2021-04-14 01:58:57,theonlycarrot,twitter.com,https://twitter.com/slime_machine/status/1382149856551079943
98,South Korean drivers.,3,2021-04-14 01:21:39,DEVGRU1,clips.twitch.tv,https://clips.twitch.tv/EntertainingAwkwardNarwhalPanicBasket--tXQEmP3ngevanD2
99,MOONMOON - Moon puts a handful of cops down,322,2021-04-14 01:18:56,spouds,clips.twitch.tv,https://clips.twitch.tv/TameCogentMarjoramPanicBasket-L5QZVBnnHNir2AqD
100,Stolen Cop Car,44,2021-04-14 01:10:07,zeefeet,clips.twitch.tv,https://clips.twitch.tv/SneakyFamousEggplantVoteNay-QjjuxLcPuFPsSTIT
101,MOONMOON - Ro Block has a hostage,503,2021-04-14 00:51:22,Mjolnir17,clips.twitch.tv,https://clips.twitch.tv/LittleInterestingOxTinyFace-gI0xgpTCt1squ1k3
102,I'm Stoppin',166,2021-04-14 00:46:17,KingJoey___,clips.twitch.tv,https://clips.twitch.tv/PerfectStrongAntDxCat-oiI-jDfW2ccXvGTO
103,Karma... Summit flips car after laughing at a flipped cop car,78,2021-04-14 00:33:20,TurnoverMission,clips.twitch.tv,https://clips.twitch.tv/AdventurousConcernedWatermelonDatBoi-LGcnndHqMkXshfT2
104,El Magneto calls out Daniel Naroditsky,2029,2021-04-14 00:32:48,mug3n,clips.twitch.tv,https://clips.twitch.tv/DifficultLazyMushroomDuDudu-FSk8iRbPeqbgk6qm
105,Ludwig says farewell to the cars bed,13,2021-04-14 00:25:35,mattyro1,clips.twitch.tv,https://clips.twitch.tv/SmellyGleamingBorkSaltBae-ezbZa4ADbVTylTg6
106,ludwig - Ludwig takes out his aggression on a movie artifact,224,2021-04-14 00:18:39,ryanrussell10,clips.twitch.tv,https://clips.twitch.tv/SmoothEnthusiasticDolphinWTRuck-IxuEuZ34rvaRVIrt
107,Lady asks streamer if they're being mind controlled by technology,71,2021-04-13 23:48:12,DadRage,clips.twitch.tv,https://clips.twitch.tv/UnusualAntediluvianAlfalfaDxCat-ovdyK2DAGNQq10hN
108,Summit forgets how to talk to people,195,2021-04-13 23:40:17,Syren__,clips.twitch.tv,https://clips.twitch.tv/SpinelessBelovedPotRitzMitz-oJtc-Jy6-AQ7Bnq8
109,10 year olds pepega,0,2021-04-13 23:33:51,drizzzybeats,clips.twitch.tv,https://clips.twitch.tv/ArtsyMoldyPeachDatBoi-M3mGct8faiedkJ2K
110,Full context to the kinds of things chat hoppers say to people. Disgusting,38,2021-04-13 23:31:54,Drizzlybear0,m.twitch.tv,https://m.twitch.tv/clip/WildCourteousPotatoDogFace-RJUZCpJPkZQIhNG5
111,Moon's take on X's solo vault failure,0,2021-04-13 23:26:40,abadbadman_,clips.twitch.tv,https://clips.twitch.tv/LightPoorDotterelWholeWheat-9r-Hkd6QqzuKpbLs
112,Tony with a Perfectly Timed Drive By,172,2021-04-13 22:59:29,VintageRuins,clips.twitch.tv,https://clips.twitch.tv/AuspiciousWealthyNightingaleChocolateRain-pu24SvLLOKvbH5wi
113,xQc has turned into a GOD improvise RPer,1432,2021-04-13 22:57:21,Simenba,clips.twitch.tv,https://clips.twitch.tv/ScaryProudPanPastaThat-3JwbKq8bdDfcH_Wx
114,summit1g - summits take on the xqc thing,3549,2021-04-13 22:51:30,LepreChAUnS_XD,clips.twitch.tv,https://clips.twitch.tv/TubularAstuteSheepCeilingCat-cK5HYJx2Jdj5wdDb
115,The cop that shot X says 'this is how bank robberies are suppose to go',1185,2021-04-13 22:50:57,MysteriiousComposer,clips.twitch.tv,https://clips.twitch.tv/AmorphousImpartialSpiderMcaT-xjNRCBGHhrWl-aAo
116,xqc makes it very clear not to chat hop,4455,2021-04-13 22:44:57,ArmoredMuffin,clips.twitch.tv,https://clips.twitch.tv/AntediluvianAgitatedDuckSaltBae-5DJGNVn-azyLDFF2
117,xQc gets NVL'd,12235,2021-04-13 22:41:05,SmileySY_,clips.twitch.tv,https://clips.twitch.tv/NimbleProudBeePanicVis-JnqzmPsUt0RwBn7z
118,Speedrunner is asked what he majored in.,1875,2021-04-13 22:41:02,Spaghettijoe450,twitch.tv,https://www.twitch.tv/chippy/clip/LongFastFerretKappaWealth-MqRR59iTiHa4kW-k
119,Lirik coming in clutch with the #AD,17,2021-04-13 22:30:42,kenny4351,clips.twitch.tv,https://clips.twitch.tv/TriumphantImportantDonkeyLeeroyJenkins-0e0YOzyvAjUvT2zS
120,Jake with the reconnect timing,22,2021-04-13 22:19:35,M_M4yhem,clips.twitch.tv,https://clips.twitch.tv/PricklyManlyPheasantLeeroyJenkins-nXdRcAAyt4RA_pvI
121,Cops do not show up during X's and Molly's bank robbery,550,2021-04-13 22:05:49,MysteriiousComposer,clips.twitch.tv,https://clips.twitch.tv/CleanTameNarwhalPeteZaroll-3s6gSAMJN5VQoRlX
122,xqc can't find any cops,54,2021-04-13 22:05:11,Spotylele,clips.twitch.tv,https://clips.twitch.tv/AdventurousCarelessNigiriMikeHogu-guvBSUgSWQFbi5Kb
123,LIRIK's comedic timing is unmatched,15,2021-04-13 22:02:28,HaznoTV,clips.twitch.tv,https://clips.twitch.tv/QuaintPatientStarlingTBTacoRight-O9IgNY6_t4lV6ccm
124,LIRIK's RP is on point in every game,165,2021-04-13 21:57:31,HaznoTV,clips.twitch.tv,https://clips.twitch.tv/MoldyCautiousPuppyGrammarKing-wA7Io7-lR6UjAIoR
125,"LIRIK with the ""playing dumb"" strats",182,2021-04-13 21:48:27,HaznoTV,clips.twitch.tv,https://clips.twitch.tv/MistyColorfulWrenLitFam-dZc8k6w5ZKFTn5g2
126,X tweets at the cops while being chased,65,2021-04-13 21:42:24,MysteriiousComposer,clips.twitch.tv,https://clips.twitch.tv/FrigidExpensiveWombatDancingBaby-dyJ0RB3kFQrmfIzc
127,Northernlion on Hasan,499,2021-04-13 21:26:09,dump_cakes,clips.twitch.tv,https://clips.twitch.tv/ManlyPerfectGoldfishEagleEye-I2DCRX5_4FeFk-M9
128,NoPixel gets a huge new sound update,0,2021-04-13 21:18:42,IslamDunk,clips.twitch.tv,https://clips.twitch.tv/CloudySeductiveLobsterHoneyBadger-6eKBOzBAAZthBvNB
129,Showing off his NES Mario Bros. skills,0,2021-04-13 21:16:14,evilprotaganist,clips.twitch.tv,https://clips.twitch.tv/InnocentSmoothHamsterBudBlast-hbhuBxt-3fgpFDwn
130,Egg Flipping With Toastie,47,2021-04-13 20:54:23,sami_E2,clips.twitch.tv,https://clips.twitch.tv/PopularHelplessTurtleBabyRage-3rSOmbJV468rDXpE
131,Ninja congratulates Ludwig on beating the record,2603,2021-04-13 20:45:07,DEisOverrated,mobile.twitter.com,https://mobile.twitter.com/Ninja/status/1382069702986506241
132,Lirik makes a dino friend.,1,2021-04-13 20:42:11,Benny0_o,clips.twitch.tv,https://clips.twitch.tv/GoldenThirstyTomatoBrainSlug-pS4O_b6Plv1y4vuM
133,Ludwig gets Emotional After Breaking the Sub Record,51,2021-04-13 20:41:33,mnightsucks,clips.twitch.tv,https://clips.twitch.tv/CovertBeautifulSheepFUNgineer-frFFOj4z8ABPpMA-?tt_medium=redt
134,Ludwig running back to his setup before he breaks the record,237,2021-04-13 20:39:12,mattyro1,clips.twitch.tv,https://clips.twitch.tv/CaringGrotesqueFlyCoolCat-Y9FO_9M0sE44ls9G
135,Ludwig surpasses Ninja as the most subbed person ever on twitch,762,2021-04-13 20:39:05,supersouker,twitter.com,https://twitter.com/ludwigahgren/status/1382070517222371329?s=21
136,Ludwig calls Ninja to tell him the news,4890,2021-04-13 20:33:21,OneOfTheSmurfs,clips.twitch.tv,https://clips.twitch.tv/AbstemiousObedientPlumageArsonNoSexy-fc0hzo4JkmTvR8I_
137,Ludwig Beats Ninja's Sub Record,11820,2021-04-13 20:32:06,Evoqu_,clips.twitch.tv,https://clips.twitch.tv/ProductiveFamousClipzArsonNoSexy-x9dncEnUrJKkuYxX
138,Kebab LUL,0,2021-04-13 20:25:06,Shnubben,clips.twitch.tv,https://clips.twitch.tv/RamshackleAstuteDunlinMingLee-9Ol1N63fbsKB5txg
139,VI VON,165,2021-04-13 20:23:23,tbsgrave,clips.twitch.tv,https://clips.twitch.tv/CalmSassyReubenTheTarFu-DxiSbDyZa-K7BZ5r
140,Cops shoot Santi's car after chasing him for 20 minutes and failing to catch him,43,2021-04-13 20:14:00,Visible-Fondant-4984,clips.twitch.tv,https://clips.twitch.tv/ZanyNimbleWoodpeckerThunBeast-V9cRR9bYQSKkPPkW?tt_medium=redt
141,BennniStreams - SHOOTING FOR NO REASON?,217,2021-04-13 20:04:09,Bangatello,clips.twitch.tv,https://clips.twitch.tv/HedonisticCulturedIcecreamDxAbomb-kBgaaz1efNIkto0f
142,Kitboga AI Upsets Scammer,804,2021-04-13 20:02:53,bwhipps,clips.twitch.tv,https://clips.twitch.tv/BelovedSmoothEyeballEleGiggle-YV3GAtRSlp0aXJHK
143,Forsen Makes The Perfect Calcuation,546,2021-04-13 19:59:57,Shmelk,clips.twitch.tv,https://clips.twitch.tv/FairFragileMonitorStrawBeary-jG_C9mfArd-byIxp
144,Kyle Pred Plows Head On Into Cars,33,2021-04-13 19:55:40,lurker_registered,clips.twitch.tv,https://clips.twitch.tv/SuaveWonderfulShrewOMGScoots-DxJmyPVwcpUB7uoi
145,Mcconnel being a bro FeelsStrongMan,39,2021-04-13 19:38:26,Toosks,clips.twitch.tv,https://clips.twitch.tv/EmpathicDirtyGoshawkDatSheffy-70bPKW8z1LO398rD
146,The God Gamer Does it against all odds PagMan,27,2021-04-13 19:20:22,Toosks,clips.twitch.tv,https://clips.twitch.tv/FlirtySaltyHarePogChamp-PLYZuZbmk-ls2c79
147,Reason why lirik isn't playing bayvon anymore Sadge,4,2021-04-13 19:19:07,Ezeelo,clips.twitch.tv,https://clips.twitch.tv/ClumsyLaconicBubbleteaDoubleRainbow-pk0_giEXqiI_AvkS?tt_medium=redt
148,Corpse Husband might switch to streaming on Twitch,0,2021-04-13 19:16:27,toastisthicc,twitter.com,https://twitter.com/CORPSE/status/1382041597152428035
149,Lirik's GTARP character got cancelled OMEGALUL,2065,2021-04-13 19:15:49,ProximatedNuke,clips.twitch.tv,https://clips.twitch.tv/FunnyMiniatureWatermelonTwitchRaid-PqbUlD8u98zm9O5-
150,xQcOW - x found gold in the bank,2,2021-04-13 19:15:16,skenoj,clips.twitch.tv,https://clips.twitch.tv/DrabSuperSwallowDeIlluminati-La38o9XPiaEnDLKe
151,new hit single by sips,9,2021-04-13 19:10:21,theshindigg,clips.twitch.tv,https://clips.twitch.tv/AttractiveDoubtfulCatThisIsSparta-6B3kuI4ZopJErScx
152,why i love korean twitch,489,2021-04-13 18:53:52,jo_jo_nyeb,clips.twitch.tv,https://clips.twitch.tv/ProudDarkHyenaRickroll-_VBsEMtFbGqHHdhj
153,The Twin- uhhh,21,2021-04-13 18:40:16,Cioki1000,clips.twitch.tv,https://clips.twitch.tv/CallousFilthyAnacondaTBTacoRight-q6--qzQJDhQrwxF_
154,This GTA stream is brought to you by.... #AD,158,2021-04-13 18:17:33,dcfilipino,clips.twitch.tv,https://clips.twitch.tv/SincereMuddyFrogPunchTrees-lqsy1KRjb_EphSMw
