,Post Title,Post Score,Created UTC,Post Author,domain,url
626,Judd takes cop to jail with him,2132,2021-04-09 00:33:39,MajorBonesLive,clips.twitch.tv,https://clips.twitch.tv/LitigiousMagnificentBunnyShazBotstix-KxB6NrVt23XZUoed
627,Haz gets called out by chatter's mom,21,2021-04-09 00:19:02,ancomanarchist,clips.twitch.tv,https://clips.twitch.tv/DoubtfulTallWeaselPartyTime-lYAr8_vD66YfVPxZ
628,shroud makes a huge discovery about spoons,110,2021-04-09 00:03:22,SyzbuH,clips.twitch.tv,https://clips.twitch.tv/PatientAliveKleeTooSpicy-BMi-8JY-6yXvQtRw
629,Isaac streamer actually loses his mind,43,2021-04-08 23:39:20,lazydictionary,clips.twitch.tv,https://clips.twitch.tv/SmoothRenownedChickenVoteYea-pQzU2xKG4yN1MdfZ
630,Hearthstone Streamer suspended from tournaments due to information released of him abusing ex gf.,78,2021-04-08 23:28:25,haisayaka,twitter.com,https://twitter.com/hsesports/status/1380206184418840576?s=21
631,Erobb221- Russell Big Brain,75,2021-04-08 23:22:13,dunked_0n,clips.twitch.tv,https://clips.twitch.tv/RelentlessRockyQuailKappaClaus-wnPMH--cuiBDkhhi
632,Pokelawls hot take on Pokimane,1766,2021-04-08 23:12:57,jeovanny315,clips.twitch.tv,https://clips.twitch.tv/FragileDeadGarlicGOWSkull-SJ22grrgtysxdHQZ
633,Ludwig checks in on Stanz,143,2021-04-08 23:05:40,Dar_Duel217,clips.twitch.tv,https://clips.twitch.tv/EsteemedObliviousYogurtBlargNaut-BMe0WBmF7AO-3_KH
634,Erobb has started transforming into a Lizard,21,2021-04-08 23:02:36,SirBallalicious,clips.twitch.tv,https://clips.twitch.tv/GeniusBeautifulJamMoreCowbell-sAYGYZwAJE_6iUxy
635,xQcOW - Like Father like Son,65,2021-04-08 22:48:52,DomFor69,clips.twitch.tv,https://clips.twitch.tv/HyperResoluteJaguarLitty-WKEp43xRFlxlZY6u
636,Party game randomly insults Peppah accurately,24,2021-04-08 22:35:37,oFyle,clips.twitch.tv,https://clips.twitch.tv/TriangularFancyKiwiGingerPower-YiZVbhOptamnLlKP
637,Two half-English speakers communicate,518,2021-04-08 22:32:37,rebooted_life_42,clips.twitch.tv,https://clips.twitch.tv/SullenSnappySowFreakinStinkin-Vq60FHVIovlo5Upz
638,"Shotz goes on OOC Rant about Penta, Accuses Powergaming",633,2021-04-08 22:32:16,coffee_bean_almond,clips.twitch.tv,https://clips.twitch.tv/SpicyTsundereBatteryPunchTrees-fUt21SiRk680bpmP
639,Kaceytron - Kacey goes off on MCYT stan's mother,2338,2021-04-08 22:26:02,pkmngal98,clips.twitch.tv,https://clips.twitch.tv/HotBlazingRabbitPeteZarollTie-TzbAWddXoqBoFr0Y
640,Stanz loses to a misclick after an hour on one minesweeper,288,2021-04-08 22:22:56,SuperCookieGaming,clips.twitch.tv,https://clips.twitch.tv/TransparentIgnorantEmuTBCheesePull-5hduV0fZ9tX08WKe
641,Apex cheater get banned mid-game after killing #1 ranked player,7,2021-04-08 22:10:33,Gundown64,clips.twitch.tv,https://clips.twitch.tv/BelovedPlainStarThunBeast-Va7fM7BGNue5I2WS
642,"KristoferYee - Streamer cries when asked how much money he makes, during e-date.",1966,2021-04-08 22:07:53,Mderose,clips.twitch.tv,https://clips.twitch.tv/ArbitraryBrainyOstrichWoofer-ZfQuajkM9iajyE0Z
643,xQcOW with 88K viewers - NICK CALLED IT,3461,2021-04-08 21:57:14,Kaoekani,clips.twitch.tv,https://clips.twitch.tv/ObeseHungryFlyBCouch-npw9SuNxeARPPKnZ
644,The Minecraft stans got Kaceytron's Instagram disabled now. They also got her Tiktok and are spam reporting her Twitch/Twitter accounts.,8166,2021-04-08 21:41:09,Cyberdickk,twitter.com,https://twitter.com/kaceytron/status/1380271712680304643
645,Twitch gonna like this,7,2021-04-08 21:40:08,Neddo_Flanders,clips.twitch.tv,https://clips.twitch.tv/ShakingBraveOysterHassaanChop-Zkvuu1Vcr8s2W64r
646,Twitch chat being based,58,2021-04-08 21:38:30,EchoOk4335,clips.twitch.tv,https://clips.twitch.tv/DeterminedGoodKuduTebowing-l8fvw8WHksJV3Min
647,Nairo is live on YouTube after a long absence,325,2021-04-08 21:27:37,Cp3thegod,self.LivestreamFail,https://www.reddit.com/r/LivestreamFail/comments/mn1z2y/nairo_is_live_on_youtube_after_a_long_absence/
648,s1mple Deagle ace with 1 clip,477,2021-04-08 21:26:20,Zoomberr,clips.twitch.tv,https://clips.twitch.tv/MagnificentRacyMouseTheRinger-K18RcEGrJyYiacgp
649,At least forsen has the balls to say it,1201,2021-04-08 21:22:22,oFyle,clips.twitch.tv,https://clips.twitch.tv/RealSpotlessSalmonCurseLit-SmTn-K__9uCxk5Ru
650,"Ludwig is going to run an EVO type event for Melee, Street Fighter 4, and Marvel vs Capcom 3",78,2021-04-08 20:51:38,KenshiroTheKid,clips.twitch.tv,https://clips.twitch.tv/IgnorantSpeedyCrowGingerPower-9nyJ_Q1kJtLjUd-H
651,xQc has a hot take after watching GTA clip,620,2021-04-08 20:47:07,MysteriiousComposer,clips.twitch.tv,https://clips.twitch.tv/ChillySmilingSproutTBTacoLeft-NiG2wSJBfNycP2V2
652,Forsen gets infiltrated by juicers,27,2021-04-08 20:42:09,oFyle,clips.twitch.tv,https://clips.twitch.tv/SmokyAcceptableMuleUWot-Bexqk7QKiAoq5Ptz
653,Sliker gives arabic lesson to Hachubby,155,2021-04-08 20:36:13,jo_jo_nyeb,clips.twitch.tv,https://clips.twitch.tv/CulturedEntertainingOrangeFeelsBadMan-0nygqPr_jF4bCcbd
654,Y has heard enough,80,2021-04-08 20:32:10,micromonarch,clips.twitch.tv,https://clips.twitch.tv/WimpyPleasantOxPJSalt-dCkw3S9baAXFDWfz?tt_medium=redt
655,"Burn (Johnny Silverhand) RPs ""Y Naught"" the sequel to X",17,2021-04-08 20:20:05,funkduder,clips.twitch.tv,https://clips.twitch.tv/SplendidFantasticAmazonKeyboardCat-UdOONt8flLSA3aFY
656,Poke avoids killing a gay man in TABS,255,2021-04-08 20:00:17,Icenezz,clips.twitch.tv,https://clips.twitch.tv/CoweringVenomousCardLitty-0uiAag82uo3YJ59u
657,Wholesome Erobb and Emmy,4091,2021-04-08 19:43:39,dunked_0n,clips.twitch.tv,https://clips.twitch.tv/SpeedyFuriousDonutSaltBae-0fSRvte4lO3assMH
658,PoyZenn - Streamer needs a second to think,2,2021-04-08 19:29:12,FARttv,clips.twitch.tv,https://clips.twitch.tv/GeniusPreciousFriesKappaRoss-Dzh5Ek6B89xNVEOJ
659,poke shows a new song he's been working on,44,2021-04-08 18:50:57,Arc___,clips.twitch.tv,https://clips.twitch.tv/DelightfulGentleOxFutureMan-Dj1Mfltg58EoUdOA
660,Hachubbys school grades,130,2021-04-08 18:40:41,Aitneko,clips.twitch.tv,https://clips.twitch.tv/AverageGoldenKleeOpieOP-F99M3RbGs_kDC7zA
661,Erobb search himself on google,76,2021-04-08 18:17:32,EchoOk4335,clips.twitch.tv,https://clips.twitch.tv/SpoopyOutstandingGarbageSSSsss-eZDrrTzmgkNhvEn3
662,xQc stream RP,333,2021-04-08 18:17:31,sgtramenIII_jpg,clips.twitch.tv,https://clips.twitch.tv/StupidFlaccidFishPupper-cRAJlb5tLHKrBkDC?tt_medium=redt
663,The Green Goblin steals Pred's car,63,2021-04-08 17:56:03,-Relevant_Username,clips.twitch.tv,https://clips.twitch.tv/OriginalKawaiiSandstormHeyGirl-BA0vhQM3jDS03h8C
664,Burn - Burn’s Amazing XQC parody “Y”,2580,2021-04-08 17:54:10,TurnoverMission,clips.twitch.tv,https://clips.twitch.tv/MistyInventiveDinosaurAllenHuhu-7tuhjz-NRpepHKGK
665,Kyle - Y wants his phone back,428,2021-04-08 17:53:32,Fightspit,clips.twitch.tv,https://clips.twitch.tv/DepressedExcitedBeefMrDestructoid-nCJFzogkqmmMlO2M
666,Reminders actually work,32,2021-04-08 17:33:28,jo_jo_nyeb,clips.twitch.tv,https://clips.twitch.tv/FriendlyDiligentYogurtBlargNaut-G6oFUY8XuxFHjaYz
667,pokelawls loses to moving text,6,2021-04-08 17:19:57,jamzyy,clips.twitch.tv,https://clips.twitch.tv/InexpensiveFunPlumageNinjaGrumpy-gYm69YIspfoAyOzS
668,TimTheTatman - BALD,1062,2021-04-08 17:08:15,ProjektBloo,clips.twitch.tv,https://clips.twitch.tv/ArbitraryRichDragonflyLitFam-ejMY8DzEk3itHSDx
669,Nick doing it again,316,2021-04-08 17:02:41,JakubC99,clips.twitch.tv,https://clips.twitch.tv/GenerousKawaiiGoblinPeteZarollTie-6CotxwnsMEjtXWon
670,RobRomansVoice - Asking the important questions.,5,2021-04-08 16:41:33,mattydeath,clips.twitch.tv,https://clips.twitch.tv/AmorphousCloudyLionResidentSleeper--oP5dnqpaeQ7H-z_
671,Nmplol Jerks Off In Public,12,2021-04-08 16:40:14,boomrapid,clips.twitch.tv,https://clips.twitch.tv/ConcernedSweetPorcupineTebowing-o6OEX_P-gmZ7gyCE
672,Lirik accidentally leaves stream on when his friends are around..,1159,2021-04-08 16:31:25,Oatsmon,clips.twitch.tv,https://clips.twitch.tv/RoundHelpfulClipzEleGiggle-g-mT8G0YRBtWmK7f
673,Nick and chance gets called homophobic slurs,1780,2021-04-08 16:27:36,kingpussay,clips.twitch.tv,https://clips.twitch.tv/TiredLittleDelicataMcaT-QkaucKVgBmG_E4UW
674,Y Naught pulls up mario cart during traffic stop,17,2021-04-08 16:20:45,avengergloomy,clips.twitch.tv,https://clips.twitch.tv/ExquisiteHyperBatteryShadyLulu-orRHI7HoqYFVw2dh
675,Burn - LET EM LEARN EZ,155,2021-04-08 16:18:54,OutLanderYO,clips.twitch.tv,https://clips.twitch.tv/AggressiveNurturingJaguarTTours-YkTkGJa9LU1sHgjZ
676,ESL CS:GO Casters reenact a scene from American Psycho,1612,2021-04-08 16:17:56,nordanvinden,clips.twitch.tv,https://clips.twitch.tv/ElatedScaryCamelMrDestructoid-4f0V-fpVBiG6FNcV
677,Phone problems(Tribute),62,2021-04-08 16:16:53,Klink8,clips.twitch.tv,https://clips.twitch.tv/UnusualWildPuddingRickroll-R8TYh2Do0yUTp3Gg
678,Judd confirms X's unban from NoPixel,50,2021-04-08 16:12:42,ye_boi__,clips.twitch.tv,https://clips.twitch.tv/ToughBumblingPartridgeCoolCat-llKCvPBrGE-K3hAA?tt_medium=redt
679,"Ashley x Nicholas ""PogO"" Polom",28,2021-04-08 16:12:05,boomrapid,clips.twitch.tv,https://clips.twitch.tv/TemperedProudParrotYee-B6jvZAKVf0apaAiY
680,imagine working on your birthday,2,2021-04-08 16:10:13,Stompy612,clips.twitch.tv,https://clips.twitch.tv/PrettiestEndearingHippoDuDudu-ffa-xsM5nl955fuQ?tt_medium=redt
681,Nick almost leaks a Cheater,1395,2021-04-08 15:59:22,kingpussay,clips.twitch.tv,https://clips.twitch.tv/CrazyStupidPancakeCoolCat-mlS_uYA0Nb4dcBUa
682,Quin Suddenly Realizes the Amazon Appeal,13,2021-04-08 15:58:32,BrevityBullion,clips.twitch.tv,https://clips.twitch.tv/TardyClearWhaleDoritosChip-wZ0SHGqbl_t0pxMP
683,Leprechaun insults Timthetatman's family on his birthday and laughs,303,2021-04-08 15:43:29,kingpussay,clips.twitch.tv,https://clips.twitch.tv/PatientFrigidGoatRitzMitz-HRCveihsl-IPklvB
684,Local technician solves computer error,13,2021-04-08 15:40:05,Vekayo,clips.twitch.tv,https://clips.twitch.tv/LazyAbstrusePorpoiseDogFace-fkx1_2hH5weW7L-Y
685,Nick has reaction for Malenas butthole,2300,2021-04-08 15:38:40,kingpussay,clips.twitch.tv,https://clips.twitch.tv/VictoriousBashfulRaccoonVoteNay-Wjf-looWJhVbpgOf
686,Sodapoppin says it...,88,2021-04-08 15:34:26,partaloski,clips.twitch.tv,https://clips.twitch.tv/FurryConfidentCiderKreygasm-TLmTEDMqVIpbNmQU
687,Chance has a pogo moment,8,2021-04-08 15:33:48,Stompy612,clips.twitch.tv,https://clips.twitch.tv/EnjoyableSincereTroutTBCheesePull-FZjVyibXbbpNISi0?tt_medium=redt
688,Streamer finds a present in the coop,13,2021-04-08 15:32:53,tomgreen99,clips.twitch.tv,https://clips.twitch.tv/GiantStylishDragonfruitFrankerZ-nFcti3z4db_TMIai
689,Soda is asked to name 3 sluts,11423,2021-04-08 15:32:46,MysteriiousComposer,clips.twitch.tv,https://clips.twitch.tv/ThankfulVainSlothBudStar-DAtqMJDn8SU-Wcbk
690,"Nmplol - ""Name 3 streamers that should not reproduce""",56,2021-04-08 15:32:09,BrorsanP3,clips.twitch.tv,https://clips.twitch.tv/BlindingFamousClipsmomHassaanChop-zq6ZJscZCgNjEWw_
691,Soda monkaW,11,2021-04-08 15:30:43,BrorsanP3,clips.twitch.tv,https://clips.twitch.tv/HilariousTenderJamDxCat-H0GUiJZ2XaavZdH5?tt_medium=redt
692,5Head Juicer move,2810,2021-04-08 15:27:56,kingpussay,clips.twitch.tv,https://clips.twitch.tv/BloodyRichCrabMcaT-mqvza0CpXMgDVvzL
693,why not chance,6,2021-04-08 15:27:44,grantmcdonald47,clips.twitch.tv,https://clips.twitch.tv/QuaintSavoryBatVoteYea-zcUBJn2aDQ1MyBeH?tt_medium=redt
694,Chance names the 3 reasons why to be a dog,10,2021-04-08 15:21:43,Stompy612,clips.twitch.tv,https://clips.twitch.tv/ToughWonderfulOstrichBrainSlug-16CGiST9y4jKLymo?tt_medium=redt
695,Nick and Soda have a PogO moment,79,2021-04-08 15:21:21,MysteriiousComposer,clips.twitch.tv,https://clips.twitch.tv/RoundHelpfulMonkeyWTRuck-xlyGgP_T7Rmgeu6W
696,Not very xqcL of you soda,47,2021-04-08 15:15:56,SmileySY_,clips.twitch.tv,https://clips.twitch.tv/TangibleObedientLyrebirdPeteZarollTie-W8jSvH_qbAZsmDcf
697,Name three streamers who should not reproduce,4805,2021-04-08 15:15:46,Brorunks,clips.twitch.tv,https://clips.twitch.tv/BreakableAmazingPotLitFam-lo9Y_EdXg5kscPgF
698,Scrapie Beats INSANE ODDS and Yeets IMPOSSIBLE Jump into Finish on Reverse Track,1575,2021-04-08 15:06:21,RealBems,clips.twitch.tv,https://clips.twitch.tv/ScrumptiousSucculentRedpandaPipeHype-aX6p_lwKlRD1dnMf
699,ScrapieTV hits crazy trick to finish track,10,2021-04-08 15:00:44,uberham,clips.twitch.tv,https://clips.twitch.tv/SwissPolishedChoughPanicVis-UcY7RlDyh8Atn3x8
700,Polom kills a fly,6,2021-04-08 14:59:43,BreadStickFactory,clips.twitch.tv,https://clips.twitch.tv/BlushingRockyIguanaDendiFace-K4D_5c9vRjS_HvSR?tt_medium=redt
701,Nick and Malena really missed each other,49,2021-04-08 14:56:19,GIltch,clips.twitch.tv,https://clips.twitch.tv/AgileAbstruseOilPartyTime-mNatlRaU2_yvyTmS
702,Streamer way too excited for KBBQ,243,2021-04-08 14:46:04,iuce,clips.twitch.tv,https://clips.twitch.tv/VibrantSneakyFriseeLeeroyJenkins-qS0Qj2hpMMMCeVwM
703,Why Nick doesn't get Malena flowers,2323,2021-04-08 14:26:12,stinkycatto,clips.twitch.tv,https://clips.twitch.tv/PreciousTentativeSkunkDoubleRainbow-fFgEajfTsYg-0vCI
704,Melena Exposes Nick,1747,2021-04-08 14:25:28,boomrapid,clips.twitch.tv,https://clips.twitch.tv/NastyBlatantStapleTBTacoRight-aYEsn6W_8TpXg4Nf
705,GM Hess chess.com employee confirms bad faith and power abuse of Hikaru's crew,5714,2021-04-08 13:53:09,Ehsan666x,twitch.tv,https://www.twitch.tv/gmhess/clip/ColdTentativeCheddarKeyboardCat-jJP6U_g6C0_sPQSA
706,Pack of TFT streamers discover new just chatting meta,37,2021-04-08 13:16:04,kidocosmic,clips.twitch.tv,https://clips.twitch.tv/CovertCredulousPlumberDoubleRainbow-f6ajM8KmcxUw4Sv0
707,"Are ya winning, son?",20,2021-04-08 12:48:26,bem13,twitch.tv,https://www.twitch.tv/mizrahhi/clip/JoyousLongRadicchioOMGScoots-Mrq41BowFrZGeXd9
708,Limmy is worried about his streaming connection,29,2021-04-08 11:12:50,Harley_Sonder_,clips.twitch.tv,https://clips.twitch.tv/RoughFunnyBananaOptimizePrime-SXiZOWnNWQEri5Nr
709,summit1g travels to cloud 10,30,2021-04-08 08:53:16,lemmonhead27,clips.twitch.tv,https://clips.twitch.tv/SeductiveTenaciousTeaGingerPower-8Q8Anzx0WKae1Uci
710,Soda having a blast playing For the King with his friends,1011,2021-04-08 08:23:28,tacolben,clips.twitch.tv,https://clips.twitch.tv/VivaciousSmellySrirachaPeanutButterJellyTime-bgR3nywvNgmGIwLm
711,Ray__C on the rough edges of NoPixel,252,2021-04-08 07:12:32,Legitimate_Twist,clips.twitch.tv,https://clips.twitch.tv/KnottyBrightMarrowTBTacoRight-Y7TWj70AxeFsTQ6V
712,everyone has a Hikaru story,283,2021-04-08 06:24:10,young-oldman,twitch.tv,https://www.twitch.tv/fionchetta/clip/EnchantingCourteousFriesPrimeMe?filter=clips&range=all&sort=time
713,Clint1717 gets a surprise for Barry74,19,2021-04-08 06:21:21,Pixtart,clips.twitch.tv,https://clips.twitch.tv/PoisedOnerousKoalaAMPEnergyCherry-gq1nDl8UqClgjyv-
714,Dundee's meeting is interrupted,169,2021-04-08 05:57:13,souleboi,clips.twitch.tv,https://clips.twitch.tv/ApatheticSmallDurianDogFace-mIVv5EJt3tchR_Te
715,Captainflowers critiques Ovilee's shoutcasting,54,2021-04-08 05:47:19,Forrest_Stump,clips.twitch.tv,https://clips.twitch.tv/SuaveCrunchyHerbsPeanutButterJellyTime-1N8LdmdCUi7HMWnX
716,A reminder that Ice Poseidon has been banned on Twitch 4 years this month,2347,2021-04-08 05:33:52,Old-Impression-3793,clips.twitch.tv,https://clips.twitch.tv/TallPoisedWombatSMOrc-OopnsbwBCJdJndqs
717,KristoferYee - Mizkif the lost child,53,2021-04-08 05:33:50,OR30_Senpai,clips.twitch.tv,https://clips.twitch.tv/PreciousEagerTruffleTheTarFu-mnu4r1EjF-pFRToS
718,xQc gets baited by chat and dono about NoPixel,37,2021-04-08 05:29:20,MysteriiousComposer,clips.twitch.tv,https://clips.twitch.tv/RacyFancySquidANELE-WM2fkusAzFeb-sQN
719,Speedy receives the full Narcos treatment on his way for his bail hearing,44,2021-04-08 05:25:29,EdwardAurelius,clips.twitch.tv,https://clips.twitch.tv/SillyHonestCormorantGOWSkull-9H8t60i4vb_0zf0o
720,Moonmoon's new character,0,2021-04-08 05:23:04,attuoz,clips.twitch.tv,https://clips.twitch.tv/FitAgreeablePeppermintItsBoshyTime--rYDay5IJLWokulU
721,Jane Obama accidentally leads police to a drug deal,29,2021-04-08 05:21:14,SpaceHamster32,clips.twitch.tv,https://clips.twitch.tv/NeighborlyDarlingManateeDAESuppy-yEW-sxgDSQIcxiBS
722,jANE notices some oxy runners,55,2021-04-08 05:19:14,_Qwaz,clips.twitch.tv,https://clips.twitch.tv/DeafUninterestedSnakeLeeroyJenkins-cM5ey5moVNU03f3N
723,Jane Obama performs a miracle!,91,2021-04-08 04:53:40,SpaceHamster32,clips.twitch.tv,https://clips.twitch.tv/SmallTsundereJellyfishFrankerZ-BeNdtX2mC0TyObGt
724,"Mrekk, 15 years old, overtakes WhiteCat as the best osu! player in the world",677,2021-04-08 04:51:20,leesh2148,clips.twitch.tv,https://clips.twitch.tv/CrazySourAirGuitarUWot-xWb89Zfa4A4lvLvX
725,KristoferYee goes on a date,3387,2021-04-08 04:28:58,Ok-Adeptness-2076,clips.twitch.tv,https://clips.twitch.tv/TiredRenownedAppleHotPokket-vajapbD1rYX5uL0n
726,KristoferYee - You know what else is broken?,25,2021-04-08 04:20:03,PlatReact,clips.twitch.tv,https://clips.twitch.tv/FantasticIntelligentTireKlappa-Nc3DAnh_IT8icssP
727,Sykkuno’s honest thoughts on xQc,254,2021-04-08 04:17:11,Necessary-Advance-42,clips.twitch.tv,https://clips.twitch.tv/AmazingMushyRedpandaPeanutButterJellyTime-bBvK6tz7eOZZR9m0
728,Trooper AJ Hunter - John Wick 4,109,2021-04-08 03:52:04,_Kaj,clips.twitch.tv,https://clips.twitch.tv/AgreeableIcySwallowAllenHuhu-1V4Vnrb47KvuoEKD
729,Tony teaches bad driver a lesson,17,2021-04-08 03:47:02,fletch1590,clips.twitch.tv,https://clips.twitch.tv/WisePuzzledOpossumKeepo-IlF-N5zawahbJTkW
730,JadeIsaBoss Friend asks the classic date question,24,2021-04-08 03:25:48,CamusTerran,clips.twitch.tv,https://clips.twitch.tv/KathishMushyMosquitoFeelsBadMan-ftwYJ9JtiPb0_TUB
731,The truth about Hikaru's Manager (Chessbae),1264,2021-04-08 03:04:21,HockeyGod69,clips.twitch.tv,https://clips.twitch.tv/UglyLovelyEelNomNom-COAj5rHE74sQxL3Z
732,loltyler1 - T1 cant swap in his ranked queue,73,2021-04-08 03:00:40,NoodleTheTree,clips.twitch.tv,https://clips.twitch.tv/HappyCourteousMangoKappa-gyqpCCce2BTZiCxY
733,Tyler raging like crazy cause league is a bugfree game Kappa,6,2021-04-08 02:59:51,retard1v9sucker,clips.twitch.tv,https://clips.twitch.tv/HedonisticAssiduousWaspKappaRoss-v1BXIbCLQ45jJe9F
734,as close as it gets.,10,2021-04-08 02:14:33,Iamien,clips.twitch.tv,https://clips.twitch.tv/ToughWanderingChinchillaOMGScoots-UkIqYZ2vKlMfRA1h
735,Soda talks to a woman,20,2021-04-08 01:19:19,-eDgAR-,clips.twitch.tv,https://clips.twitch.tv/DifferentAliveLlamaRlyTho-1VGrMJV01_snATv_
736,IOKI is so nice for offering tyler1 free merch,19,2021-04-08 01:13:39,uruha_tv,clips.twitch.tv,https://clips.twitch.tv/AnimatedScrumptiousOcelotOptimizePrime-Fk2HVBUoTkMz6Zid
737,WillNeff's new cam Kreygasm,20,2021-04-08 01:08:30,MonkeyKingBill,clips.twitch.tv,https://clips.twitch.tv/DifferentObliquePistachioFutureMan-O0iIXU5DqrZYlzAr
738,Will Neff has the best Unboxing of his life,90,2021-04-08 01:08:29,Plumpblumkin,clips.twitch.tv,https://clips.twitch.tv/AverageDeafGrassSmoocherZ-W2KtfejKw5t3jcQX
739,MochiGasm TTours,2,2021-04-08 01:06:12,freegx1,clips.twitch.tv,https://clips.twitch.tv/SilkyUnsightlyAubergineUncleNox-2TW7_pbDYdm5TtiN?tt_medium=redt
740,Britt overcomes the Law of Lamont,33,2021-04-08 01:01:44,SirBallalicious,clips.twitch.tv,https://clips.twitch.tv/AuspiciousGlamorousPeachPJSugar-yhUgIZghsR_mmNx5
741,Miamalkova - Chat Waiting For A Slip Up,77,2021-04-08 00:59:15,Calm_H1ndu_Cow,clips.twitch.tv,https://clips.twitch.tv/TransparentBoldPorcupineBigBrother-YRElOhGQhNWb0mWz
742,"Streamer says xqcL 77,777 times in 13 hours",287,2021-04-08 00:58:13,dgarug,clips.twitch.tv,https://clips.twitch.tv/LivelyReliableDuckTinyFace-EQtPbBfBAk-BD9YN
743,t1 REVEALS HIS SMURF SUB LAST PICK,7,2021-04-08 00:56:10,uruha_tv,clips.twitch.tv,https://clips.twitch.tv/ThirstyToughFungusMoreCowbell-V-WYoFWDuzO00kYa
744,We are really missing X,1054,2021-04-08 00:46:00,cSnipu,clips.twitch.tv,https://clips.twitch.tv/MistyHumbleCattleDerp-n4D-9GUk7G5dveo-
745,Mia Malkova.. KKonaW,11428,2021-04-08 00:42:04,dignuss,clips.twitch.tv,https://clips.twitch.tv/AbrasiveSinglePlumageTheRinger-qlquzGgqKvTJCFoY
746,Ben Finegold commenting about Chessbrah vs Hikaru drama,202,2021-04-08 00:39:32,DrKillPatient__,clips.twitch.tv,https://clips.twitch.tv/MagnificentBrainyFriesChocolateRain-Br0MGb8uI8vBzN8I
747,Chompy,22,2021-04-08 00:33:51,metalburning,clips.twitch.tv,https://clips.twitch.tv/BombasticImpartialZucchiniKreygasm-IQ2gKO5Qed-lamjl
748,18 month ban on Twitch without replies from the site lifted shortly after having the case reach the front page of LSF.,3601,2021-04-08 00:19:10,justalazygamer,twitter.com,https://twitter.com/RyanWasTakenToo/status/1379934230789111811
749,Kitboga chokes on his lunch after Scammer asks difficult HR form question,2255,2021-04-08 00:14:52,beegeepee,clips.twitch.tv,https://clips.twitch.tv/NaiveDependableDumplingsDoggo-thpRjE1HAQ3j4k2c
750,nino gets out the hospital,10,2021-04-08 00:10:58,aarbee_,clips.twitch.tv,https://clips.twitch.tv/DullCoweringTrollAMPEnergy-4sgUSas23n5RV-xG?tt_medium=redt
751,Nick reveals his celebrity crush,2164,2021-04-07 23:52:16,Embarrassed_Rent_882,clips.twitch.tv,https://clips.twitch.tv/AliveMushyFishDoggo-9WdFLQ7jO3xRHnho
752,nicks favorite type of milk,73,2021-04-07 23:50:59,tizthewizard,clips.twitch.tv,https://clips.twitch.tv/GrossDarkBottleBibleThump-Dbp2PIMjmEq5rKWD
753,Korean streamer lost to a bird,31,2021-04-07 23:45:51,lini_13,clips.twitch.tv,https://clips.twitch.tv/AwkwardIcyDootChefFrank-5iHuupsf5iM4NCNq
754,Mizkif - Low T Rinaudo,25,2021-04-07 23:40:27,3layersofcheese,clips.twitch.tv,https://clips.twitch.tv/TangibleSweetDragonTBTacoLeft-CS37ASoKbLP981bT
755,Tyler1's intervention,439,2021-04-07 23:36:39,thedukaismywand,clips.twitch.tv,https://clips.twitch.tv/BlightedBlatantClamShadyLulu-Xe34GMf_wNzdhi74
756,"Vargos RP - Speedy is granted bail $150,000",31,2021-04-07 23:16:53,STDeans,clips.twitch.tv,https://clips.twitch.tv/IncredulousAmusedCiderKappaWealth-jTBKzPZW8erVZBxn
757,Streamer Gets Emotional Watching Friend Made Montage,6,2021-04-07 23:14:02,skater687,clips.twitch.tv,https://clips.twitch.tv/MoldyDullRuffTF2John-0sg887bkKWYl_MFs
758,Malena asks Nick what her favorite color is,6330,2021-04-07 23:04:06,IsaacM42,clips.twitch.tv,https://clips.twitch.tv/BlazingBrainyBatPunchTrees-pEs4sqUjcG-fTujy
759,Tyler's head is actually dented from wearing his headset so much.,20,2021-04-07 23:00:18,iBanditss2,clips.twitch.tv,https://clips.twitch.tv/SpicyExcitedChimpanzeeDogFace-J3Zwrb06RqBGBRAo
760,Erobb gets a confidence boost,505,2021-04-07 23:00:05,SirBallalicious,clips.twitch.tv,https://clips.twitch.tv/AmazingVictoriousPlumageHeyGuys-Omdz7pe4mG0Ahska
761,NL gets crazy with it,77,2021-04-07 22:57:14,xhantari,clips.twitch.tv,https://clips.twitch.tv/ClumsyResourcefulCoyoteTTours-qZ0XrAHNSna08Kgu
762,Twitch viewer does a legal drug,21,2021-04-07 22:54:53,OmegaEggFan,clips.twitch.tv,https://clips.twitch.tv/EnergeticCheerfulTroutBatChest-Gxp6V2ffgOJ3bHiM
763,imaqtpie does an impressive impersonation of a kawaii anime girl,18,2021-04-07 22:51:10,Ayyyoni,clips.twitch.tv,https://clips.twitch.tv/FineRelentlessStarNerfBlueBlaster-dTGyeb5SEJiZNS0u
764,Hasan watches his epic basketball highlights reel,1626,2021-04-07 22:48:47,tzingkha,clips.twitch.tv,https://clips.twitch.tv/TrappedSpookyClipsmomGOWSkull-su0__s1XtU3KGfve
765,R6 caster makes a joke,49,2021-04-07 22:41:45,adammma9,clips.twitch.tv,https://clips.twitch.tv/OpenRichTaroShadyLulu-AMQK00oR0R5VBBqB
766,XQC with an absolute throw,52,2021-04-07 22:40:32,westerly2k,clips.twitch.tv,https://clips.twitch.tv/MoldyShakingPepperoniCharlietheUnicorn-ZXC4xpQOra8DCOfr
767,Shroud in Vacation,11,2021-04-07 22:30:14,cookoojeffy,clips.twitch.tv,https://clips.twitch.tv/OutstandingBrightKangarooAliens-y-aaIACDJ73EPdOx
768,Shroud goes Ultra Instinct,29,2021-04-07 22:29:39,Phellxgodx,clips.twitch.tv,https://clips.twitch.tv/SpinelessCorrectIcecreamTheRinger-jrUlNC2SaAE2vgdz
769,Eric Hansen and Hikaru Nakamura Getting into a brawl outside St Louis Chess Club after Nakamura loses a blitz game. Commnetary by Yasser Seirawan.,2386,2021-04-07 22:29:18,HockeyGod69,clips.twitch.tv,https://clips.twitch.tv/SpeedyDeafStapleHotPokket-6Dh9yoYMMJnKj3u3
770,Erobb gets left behind,25,2021-04-07 22:18:57,EchoOk4335,clips.twitch.tv,https://clips.twitch.tv/PopularScaryLettuceKlappa-OgxFoRFN6cR8fk3B
771,Erobb gets bullied by a Door Handle,11,2021-04-07 22:18:24,SirBallalicious,clips.twitch.tv,https://clips.twitch.tv/ClearAssiduousMilkKappaPride-KH7nir2JEMagbi50
772,XQC soon to be unbanned from nopixel.,238,2021-04-07 22:17:03,MiniEFT,clips.twitch.tv,https://clips.twitch.tv/ApatheticThankfulButterOSfrog-V0i9LbsAv9XYyHAD
773,Mizkif - Miz....,50,2021-04-07 22:12:13,cr4zyyyy,clips.twitch.tv,https://clips.twitch.tv/CallousArtisticSushiNotLikeThis-hnwQehVH1ket2ZMB
774,this ain't hard,17,2021-04-07 22:09:03,oFyle,clips.twitch.tv,https://clips.twitch.tv/VibrantSourMageDerp-wMr-un9BieTcJz9u
775,Niftski becomes the first person to beat Super Mario Bros in 4:54.,235,2021-04-07 22:02:30,Njbrother,clips.twitch.tv,https://clips.twitch.tv/QuaintCharmingWolverineChocolateRain-JEJcgoErXf7VjSFj
776,Nick and Malena do the Polom Dance,32,2021-04-07 21:48:05,TheCreativeNick,clips.twitch.tv,https://clips.twitch.tv/AgitatedAbstemiousWoodpeckerTriHard-aQISZnW28LhmWwYL
777,DONT TEST ME B**CH!,4,2021-04-07 21:45:09,InsideXan,clips.twitch.tv,https://clips.twitch.tv/FragileEnjoyableAlfalfaOptimizePrime-XADCe2NjwH5qXe5c
778,Miz and Malena do the sub dance,527,2021-04-07 21:44:34,InsertUsernameHere32,clips.twitch.tv,https://clips.twitch.tv/DeadVainRatAMPTropPunch-Hwy1nuhPbsjvqg-b
779,Korean streamer does the Dragon Ball Fusion Dance,110,2021-04-07 21:43:41,88c,twitch.tv,https://www.twitch.tv/mallang_peach/clip/ToughCarelessPhoneFreakinStinkin--WWkEr_wZiU3jS6m
